model,description
polo,"Metallic star silver, ideal runabout with long mot!!, Upgrades - Manual Glass Sunroof Slide & Tilt, Driver's Air Bag, Next MOT due 01/03/2016, Average bodywork, Grey Cloth interior - Good Condition, Tyre condition Good, 5 seats, NEWPORT CAR COMPANY LTD..HAND PICKED CARS AT LOW PRICES!!, Family run business, Hand picked quality cars at low prices!!! FINANCE AVAILABLE!!, £450"
astra,"Burgundy Red, PRICED FOR QUICK SALE / DECENT LOOKING CAR / DRIVES WELL, Next MOT due 14/06/2015, Service history, Air conditioning, Radio / cassette player, Electric front windows and door mirrors, Trip computer, Digital information display, Ambient exterior temperature display, Power assisted steering (PAS), Remote central locking, Immobiliser, Front airbags, ABS, 3 x 3 point rear seat belts, Height adjustable seat, Height adjustable steering wheel, Split folding rear seats, Roof rails, Cup holders, Etc.... 5 seats, Inexpensive Astra Estate in Decent Condition For Age and Mileage.  Quite a good looking car and very tidy inside.  Nine Stamps in the Service Book (last recorded @ 89,418 Miles).  HPI Clear.  PLEASE NOTE SHORT MOT (mid June) AND WILL REQUIRE SOME WORK FOR NEXT MOT.  Smokey on start-up when cold, n/s/f tyre close to legal limit, Oil Leak and Engine Management Light in On.  Otherwise car drives surprisingly well and still feels tight despite its miles!  TO BE SOLD AS SEEN (No Warranty) but independent inspections and test drives are always welcome., A Family Business Since 2005 ~ Over 30% of Our Sales are Repeat Business or Recommendations....., £295 ono"
500,"BLUE, 4 seats, 1.3L Engine,cheap tax and insurance,Road Tax Cost Only £20 Per Year, Ideal First Car, 12months Mot , Full Service History+Pre-sale Service in our Work-shop,very good condition clean inside and outside, Hpi Clear Never Been Involved in Accident.,.***** For More Info. About This Car Please Call Us on 07402589892 Any Time. +++ Location: West Drayton UB7 7RU. Only 5 minutes away from Heathrow Airport - M4 - Junction 4, M25 - Junctions 15 & 16 All Major Cards Accepted. Drive away insurance, P/x Welcome++++Finance Available++++ Open 7 days. Extensive Warranty Packages Available, £4,200"
polo,"RED, *TIMING BELT REPLACED* HPI CLEAR* WELL MAINTAINED WITH SERVICE HISTORY* IN GOOD CONDITION THROUGHOUT* ECONOMICAL* LOW INSURANCE GROUP*, Sunroof Electric, Alloy Wheels, Electric Windows, In Car Entertainment. 5 seats, 2 ORIGINAL KEYS, MOT TILL 15/09/2015 - LOTS OF RECEIPTS + ORIGINAL MANUALS IN FOLDER - CALL NOW TO BOOK AN APPOINTMENT!!, WE WILL TAKE ANY CAR IN PART - EXCHANGE - DEBIT & CREDIT CARDS ACCEPTED, £549 p/x welcome"
astra,"Vauxhall Astra Good runner, 10 months MOT, AC, cheap car, cheap to insure, fog lights, sterling wheel remote, height adjustable driver seat, just done the full services, alloys wheels, good condition tyres, spare wheel. Offers welcomed., For any others details contact me via phone., Thank you for watching., SILVER, 5 seats, £389"
500,"Metallic WHITE, FREE 5 DAYS DRIVE WAY INSURANCE, White Cloth interior, 5in Touchscreen Radio, 3x3 point rear seat belts, Air conditioning, Airbags, Alarm, Alloy wheels, CD Player, Central locking, Cruise control, Electric door mirrors, Electric windows, Folding rear seats, Immobiliser, Power steering, Remote central locking, Traction control. 4 seats, CALL US ON 07886763277, £4,495"
astra,"RED, 11 Months Mot, Very Nice to drive, Folding rear seats, Power steering, Sunroof, Electric windows, Central locking, Airbags, Radio. £390 ono"
focus,"SILVER, Black Cloth interior, Air-Conditioning, Electric Windows, Heated Front Screen, In Car Entertainment, Seats Electric. 5 seats, County Motors have been established for over 4 years with Managing Director Nick having over 20 years car experience, All our cars come with a hpi check, warranty, pre delivery inspection and a full valet. We can offer finance on our vehicles from as little as 4% If there is anything we have missed please feel free to give us a call., £500"
focus,"Metallic SILVER, Air-Conditioning, Alloy Wheels, Computer, Electric Windows, Heated Front Screen. 5 seats, OUT OF HOURS TEL 07891528583, £490"
corsa,"VAUXHALL CORSA 1.2 5 DOOR PETROL, RED, Full service history, Electric windows, CD player, Folding rear seats, Child seat points (Isofix system), Metallic paint, Spare wheel (Full), Power steering, Steering wheel rake adjustment, Steering wheel reach adjustment, Central locking, Alarm, Driver's airbags, Passenger airbags. 5 seats, £500"
corsa,"GREEN, 4 MONTHS, FULL VOSA HISTORY, WARRANTED LOW MILEAGE, VERY ECONOMICAL, LOW INSURANCE GROUP, ENGINE CLUTCH AND GEARBOX RUNNING SMOOTH,, Sunroof Manual, Electric Windows, In Car Entertainment. 5 seats, GOOD TYRES ALL ROUND, SMOOTH DRIVE, OPEN 7 DAYS A WEEK, ANY PART EX WELCOME, NO TIMEWASTERS,, £295 p/x welcome"
astra,"Repair or spares, new exhaust and ecu told by rac it was the fault , won't start suspect sensor, I'm disabled so cannot repair myself run fantastic til after a new exhaust, then warm start prob then none starter , engine, gearbox ,diff, electrics all run perfect til then. Sure some one who is a mechanic could sort very quickly., GREY, Electric windows, Air conditioning, Height adjustable driver's seat, Height adjustable passenger seat, Folding rear seats, Spare wheel (Full), Power steering, Steering wheel rake adjustment, Steering wheel reach adjustment, Central locking, Immobiliser, Driver's airbags, Passenger airbags. 5 seats, £250"
corsa,"Light pink/Salmon colour. MOT due in November 2015. Good drive, no mechanical issues. 82,000 miles. Ideal for a first car as cheap to insure. Electric Window and Electric central locking. CD player., The only issues with the car is that the passenger window does not work, and windscreen wipers only work on fast speed. Also, has a few scratches on the front bumper., Have had this car for 5 years and has served me well, I have bought a new car which is why i am selling this one., Pick up in Chiswick, Ask for any more details :-), RED, 2 owners, Next MOT due 23/11/2015, Part service history, Electric windows, CD player, Folding rear seats, Power steering, Central locking, Alarm, Immobiliser, Driver's airbags, Passenger airbags. 5 seats, £520"
500,"Twin air, leather black and grey seats, parrot Bluetooth device, air con, driver and passenger adjustable seats, electric side mirror control, BLACK, 3 owners, Full service history, Electric windows, Air conditioning, CD player, Leather trim, Height adjustable driver's seat, Height adjustable passenger seat, Folding rear seats, Central locking, Immobiliser, Driver's airbags, Passenger airbags. 4 seats, £4,300"
golf,"RED, DAMAGED DRIVERS DOOR, Alarm, Computer, Electric Windows, In Car Entertainment. 5 seats, TO VIEW OUR FURTHER 500 SIMILAR DAMAGED VEHICLES GO TO www.chaseautos.com, £375"
corsa,"Solid Blue, 12 months MOT, Good bodywork, Black Cloth interior - Good Condition, Tyre condition Good, Air-Conditioning, Alarm, Alloy Wheels, Electric Windows, In Car Entertainment. 5 seats, £495"
polo,"One Owner car very clean also has the original Volkswagen alarm fob, RED, 1 owner, Next MOT due 16/05/2016, Part service history, Electric windows, Spare wheel (Space-saver), Power steering, Central locking, Alarm, Immobiliser, Driver's airbags, Side airbags. 5 seats, £695"
fiesta,"BLACK, ++ 9 MONTHS MOT ++ ONLY 3 PREVIOUS OWNERS ++, Alloy Wheels, In Car Entertainment. 5 seats, LOOKS AND DRIVES WELL FOR AGE, PRICED TO SELL..., Open 7 days a week, Monday-Thursday 9 til 7, Friday 9 til 6, Saturday 9 til 5 and Sunday 11 til 4, £290 p/x considered"
500,"SILVER, Upgrades - Air Conditioning, Metallic Paint, Service history, Standard Features - Electric Front Windows, Radio/CD/MP3 Player. 4 seats, £3,750"
500,"Immaculate in and out, WHITE, 4 seats, £3,200"
500,"Low mileage, 60+ mpg, great looking reliable car! 3 previous female owners., WHITE, Electric windows, CD player, Leather trim, Height adjustable driver's seat, Folding rear seats, Spare wheel (Space-saver), Power steering, Steering wheel reach adjustment, Central locking, Driver's airbags, Passenger airbags. 4 seats, £4,295"
corsa,"GREEN, Next MOT due 30/04/2016, Sunroof Manual, Electric Windows, In Car Entertainment. 5 seats, REGISTERED ACCIDENT DAMAGED, NOW REPAIRED., ALL USUAL AUCTION TERMS AND CONDITIONS APPLY., POST CODE M26 2TA, FOR FULL STOCK LIST GO TO www.radcliffecarauctions.co.uk, SORRY WE CANNOT REPLY TO EMAILS., OUT OF HOURS MOBILE 07809387718., £390"
fiesta,"RED, PAR EX TO CLEAR.. Drives Perfect, Sunroof Manual, In Car Entertainment, Airbags, Radio, Immobiliser, Central locking. 5 seats, ** We accept American Express And All debit and Credit Cards. For more info visit our webside ***, £245"
500,"Looking to sell my brilliant fiat 500 to fund my wedding. She is the most fantastic car, excellent MPG, full service history, recently serviced and passed recent mot. I've had her since brand new and she has lovely red seats! Great condition and will be sad to see her go. Car will be fully valeted inside and out prior to sale., BLACK, 1 owner, Next MOT due 01/03/2016, Full service history, Electric windows, CD player, Spare wheel (Full), Power steering, Central locking, Driver's airbags, Side airbags, Passenger airbags. 4 seats, £4,000"
focus,"Sell/swap with mercedes a classe  1.4 1.6 automatic, WHITE, Electric windows, Air conditioning, CD player, Height adjustable driver's seat, Central locking, Driver's airbags, Side airbags. 5 seats, £500"
focus,"GOLD, This is a very clean example. Tidy inside and out. Drives very well. Good tyres all round., Air-Conditioning, Alloy Wheels, Electric Windows, In Car Entertainment. 5 seats, Viewing by appointment only, £495"
golf,"RUNS AND DRIVES FINE,, , NEEDS TRACKING AND TIRES., , AIRBAG WARNING LIGHT ON., , EXHAUST NEEDS ATTENTION AS IT HAS A SLIGHT BLOW., , COULD DO WITH NEW STARTER MOTOR BUT WORKS FINE AS IS., , OPEN TO OFFERS, SILVER, 4 owners, Next MOT due 08/01/2016, Part service history, Electric windows, CD player, Height adjustable driver's seat, Folding rear seats, Power steering, Central locking, Alarm, Immobiliser, Driver's airbags, Passenger airbags. 5 seats, £510"
astra,"Great car, good condition inside and outside and runs well. Selling because no longer need car. Has full service history. All tyres are also good. Had car for 2 and a half years no problems., SILVER, 3 owners, Next MOT due 25/06/2015, Full service history, Electric windows, Central locking. 5 seats, £380"
corsa,"BLUE, Next MOT due 19/11/2015, Cloth interior, Electric Windows, In Car Entertainment. 5 seats, £500 p/x to clear"
focus,"BLUE, ELECTRIC WINDOWS,TOP GHIA MODEL,WOOD TRIM,ELECTRIC MIRRORS,RADIO CD,, Next MOT due 05/03/2016, Black Cloth interior, Air-Conditioning, Electric Windows, Heated Front Screen, In Car Entertainment, Seats Electric. 5 seats, £345 p/x welcome"
polo,"BLUE, LONG MOT AND TAXED, EX LADY OWNER, EXTREMELY LOW MILEAGE, SUNROOF,GOOD RUNNER, NO FAULTS AT ALL, LOW INSURANCE GROUP, IDEAL FOR FIRST CAR, P/X WELCOMED, HPI CLEAR, Next MOT due 01/05/2016, Full service history, 3x3 point rear seat belts, CD Player, Electric windows, Folding rear seats, Power steering, Airbags, Radio. 5 seats, All major banks cards accepted, our address is 1 Vicarage Lane Ilford IG1 4AG Tel: 07989 424242, We are open 7 days a week 9.30am till 6.30pm alternative appointment can be arranged, please visit our website at www.redbridgecarsales.co.uk to view our wide range of top models, we can arrange delivery please ask for a competitive quote, £500 p/x welcome"
500,"BOSSA NOVA WHITE, WITH MATCHING HALF LEATHER INTERIOR, LOVELY CONDITION INSIDE AND OUT AND 1 PRIVATE OWNER FROM BRAND NEW, REALLY MUST BE VIEWED TO BE APPRECIATED, FULL FIAT SERVICE HISTORY APART FROM LAST SERVICE WITH 7 STAMPS IN THE SERVICE BOOK, AND JUST BEEN SERVICED, MOT DUE DATE 29TH MAY 2016 WITH NO ADVISORIES, JUST HAD NEW BRAKE DISCS AND PADS FITTED, CAMBELT AND WATER PUMP CHANGED AT 59317 MILES ON 14TH FEB 2014, HPI CLEAR, 2 KEYS. THIS FIAT 500 MAKES AN IDEAL COMPACT FASHIONABLE SMALL CAR IN THE BEST COLOUR, ALSO ONLY £30 A YEAR TO TAX AND CHEAP TO INSURE AND RUN AND FIRST TO THIS CAR SEE WILL BUY. Specification includes- Power assisted steering with city button, Electric front windows, Electric door mirrors, Air conditioning, Remote central locking, Radio/CD player with usb and remote control, Bluetooth (Blue and me) with voice control, Trip computer, Alloy wheels with locking wheel nuts, Adjustable leather steering wheel, Height adjustable drivers seat, Front door bins, Cup holders, Under seat storage on passenger seat, Folding rear seat, Airbags, Isofix child seat anchor points, Airbags, Anti lock braking system with EBFD, Engine immobiliser,  Colour coded bumpers and door mirrors,  Rear wash wipe, Day time running lights, Tinted glass, Factory fitted carpet mats. ALL DOCUMENTS AVAILABLE FOR INSPECTION, OPTIONAL WARRANTIES AVAILABLE UP TO  2 YEARS, TEST DRIVES WELCOME, PART EXCHANGES WELCOME, VIEWING BY APPOINTMENT ONLY DAY OR EVENING., £4,499 p/x welcome"
500,"RED, Next MOT due 31/12/2015, Black Part leather interior, Electric Windows, Air conditioning, Electric door mirrors, CD Player, Alarm, Airbags, Remote central locking, Power steering, Blue & Me phone prep, 16"" Alloy wheels. 4 seats, Experian auto check clear, £3,990"
focus,"Metallic GREEN, 2 Keys, Next MOT due 04/10/2015, Grey Cloth interior, Airbags, Electric windows, Central locking, CD Player, Power steering, Folding rear seats, Height adjustable drivers seat, Rear wash wipe. 5 seats, Starts and drives, in need of some tlc or ideal for parts hence price, £250"
corsa,"Metallic SILVER, VERY RARE FIND IN THIS CONDITION WITH THIS MILEAGE., Next MOT due 25/03/2016, Black Cloth interior, Sunroof Manual, In Car Entertainment. 5 seats, NO OFFERS NO WARRANTY THIS PRICE IS A JOKE, £399"
polo,"RED, 5 seats, 1996 Volkswagen Polo 1.6cl 5dr Estate ****12 MONTHS M.O.T**** Finished in sebring red with contrasting charcoal trim, electric  windows,sunroof,mirrors,central locking,power steering,sony stereo,very useful dual purpose vehicle.Superb Volkswagen reliability,Very Good fuel economy, lovely car throughout,2 owners. Well Maintained. 12 Months m.o.t. Open to any Inspection. Long Test drive offered. Part exchange welcome., £449"
500,"Metallic BLACK, Red Cloth interior, Electric Windows, In Car Entertainment. 4 seats, PRICE INCLUDING 12 months Warranty {no warranty available on part exchange & clearance cars], £3,993"
corsa,"Metallic FOREST GREEN, TAKEN IN PART EXCHANGE // PERFECT FIRST TIME CAR // CHEAP TO INSURE AND TAX //, Part service history, Good bodywork, Black Cloth interior - Good Condition, Tyre condition Average, Sunroof Manual, Computer, Electric Windows, In Car Entertainment. 5 seats, VERIFIED WARRANTED MILEAGE // FINANCE PACKAGES AVAILABLE. VIEWING STRONGLY RECOMMENDED. COME AND VISIT US AND VIEW OUR CARS IN OUR INDOORS SHOWROOM. FIVE DAY DRIVEAWAY INSURANCE CAN BE PROVIDED WITH AVIVA // VIEW OUR WEBSITE FOR MORE QUALITY USED CARS. ALL MAJOR CARDS ACCEPTED. WARRANTY AVAILABLE 3, 6,12 MONTHS BY WWW.RACWARRANTY.CO.UK, MaKiNg, BuYiNg A UsEd CaR, JuSt A SiMpLe HaNdShAkE...., £489 p/x welcome"
astra,"Electric front windows good condition good runner no MOT!, BLUE, 5 seats, £350"
polo,"Blue, Petrol, Manual, 16v DOHC, Starts and drives very good, Next MOT due 18/08/2015, Airbags, Alloy wheels, Electric door mirrors, Electric windows, Folding rear seats, Power steering, Radio, Sports seats, Sunroof, Central locking, Cloth Interior, ABS. 5 seats, Viewing by appointment, £650"
astra,"RED, Cheap run around, engine and gearbox are fine, Air-Conditioning, Electric Windows. 5 seats, Finance arranged, any inspections wecome, call to discuss any queries, £250"
500,"RED, IN CAR ENETRTAINMENT, WINDOWS MEMORY CARD, MULTI FUNCTION STEERING WHEEL, DRIVES 100% SPOT ON, HISTORY SHOWING 81K, CLEAN INSIDE AND OUT, DRIVES SUPERB, Next MOT due 30/03/2016, Service history, Clean bodywork, Interior - Excellent Condition, Tyre condition Good, Air-Conditioning, Alloy Wheels, Electric Windows, In Car Entertainment. 4 seats, REQUIRES A LITTLE ATTENTION TO BODY WORK, ALL PREVIOUS MOT's, FIRST TO SEE WILL BUY, A WIDE RANGE OF FINANCE PACKAGES AVAILABLE, WARRANTY PACK AVAILABLE, ALL CREDIT AND DEBIT CARDS ACCEPTED, PART EXCHANGE WELCOME, A STUNNING EXAMPLE,THAT'S NOT TO BE MISSED... YOU CAN FIND US AT WILSDEN ROAD, SANDY LANE, BRADFORD, BD15 9AD... TELEPHONE 01274 497733 OR 07752459331 ANYTIME., OPENING HOURS MON TO SAT 10:00 TILL 18:00, SUNDAYS 11:00 WHILE 17:30, £3,650 p/x welcome"
focus,"BLACK, DRIVE AWAY INSURANCE AVAILABLE, OVER 500 CHEAP PX CARS IN STOCK FROM £299-£29,990, Next MOT due 07/01/2016, Alloy Wheels, Electric Windows, In Car Entertainment. 5 seats, L.S.C PX SITE - OLD LIVERPOOL RD WA5 1BU, 01925633701, WWW.TRADECENTREWARRINGTON.CO.UK, £390"
corsa,"GREEN, Great Condition Inside & Out, Ideal First Car, Next MOT due 28/08/2015, Clean bodywork, Interior - Clean Condition, Tyre condition Good, Air-Conditioning, Alarm, Alloy Wheels, Electric Windows, In Car Entertainment. 5 seats, Part exchange welcome, Hpi clear, AA/RAC inspection welcome, all major credit/debit cards accepted, Experian auto check clear, £490 ono"
focus,"GREEN, GENUINE LITTLE PX CAR,, DRIVES FAULTLESS, MOT., Air-Conditioning, Alloy Wheels, Electric Windows, In Car Entertainment. 5 seats, HPI CLEAR..2 KEYS... PX POSS, £495"
focus,"GOLD, TRADE CARS NORTHWICH LTD CW97DR CALL 07880350295 / 07760670682, Upgrades - Metallic paint, Cloth trim, Standard Features - 6x15 alloy wheels, Electric front windows, One touch open on drivers window, Stereo radio/cassette model 4000N/4 speakers, Sports style front seats, Remote control central/double locking, Immobiliser-Passive Anti-Theft System (PATS), Driver's seat height adjustment. VISIT OUR WEBSITE WWW.TRADECENTREWARRINGTON.CO.UK, £490"
focus,"SILVER, Cambelt & Water pump changed, New Clutch with receipts, MOT May 2016, 2 Keys, currently taxed, Full Service History,, Upgrades - CD Player, All windows electric, Standard Features - Air-Conditioning, In Car Entertainment. 5 seats, Noisy Engine hence low price, besides that it drives very nice., HPI Clear, Warranty and Delivery options available, test drives welcome,Debit Cards accepted, £450"
golf,"BLUE, 5 seats, 5 doors, 5 seats, 2 former keepers, Mot'd till Aug 2015 with NO ADVISORY NOTES on it, part service history ( 9 VW main dealer's stamps and 1 private garage ), Experian auto check CLEAR i.e. NO outstanding finance, NOT written off etc. with REPORT, Bodywork is not clean, Please go through all the photos, One of rear door is stuck (does not open), Part exchange possible at trade value; please email your cars full registration no, mileage, colour and how much you want for it, All major Debit and credit cards are accepted for payment subject to a charge, Open 7 days a week, Please ring us an hour before you come to arrange viewing,, £395"
polo,"Rosso Red, MOT LATE JULY 2015, HPI CLEAR, FULL SERVICE HISTORY, EXCELLENT CLEAN BODYWORK, IMMACULATE INTERIOR, DRIVES SUPERBLY, CHEAP INSURANCE & TAX, 5 seats, great tyres, electric mirrors, excellent MPG, spare wheel and tool kit, rear wash/wipe, WILL REQUIRE CLUTCH REPLACMENT 9CAN STILL BE DRIVEN), We are a main dealership group trade department and this is a genuine part exchange from one of our sites. Please call for any details., £290"
corsa,"BLUE, very good condition drive very nice cambelt been done low mileg, Next MOT due 27/05/2016, Full service history, Good bodywork, Interior - Good Condition, Tyre condition Good, Airbags, Central locking, Sunroof. £500"
500,"REDUCED FOR QUICK SALE 2010 YELLOW , CHEAPEST LOUNGE WITH PANORAMIC ROOF IN THE MARKET, Blue and Me with USB port, Dualdrive PAS, MP3 compatible radio/single CD player, Chrome pack , PANORAMIC ROOF, ALLOY WHEELS, START/STOP CITY DRIVE OPTION.- 500. 4 seats, YELLOW, 2 owners, Full service history, Electric windows, Air conditioning, MP3 player, CD player, Height adjustable driver's seat, Height adjustable passenger seat, Alloy wheels, Spare wheel (Full), Power steering, Steering wheel rake adjustment, Cruise control, Traction control, Central locking, Alarm, Immobiliser, Driver's airbags, Side airbags, Passenger airbags. 4 seats, £4,395"
astra,"MOT just expired (4th May 2015)., BLUE, 5+ owners, Part service history, Electric windows, Air conditioning, CD player, Spare wheel (Space-saver), Power steering, Central locking, Driver's airbags, Passenger airbags. 5 seats, £300"
golf,"Metallic Blue, MOT March 2016. Age related marks, runs and drives, cheap tax and insurance bracket.  Steel tyre on passenger side has been replaced now with alloy and new tyre, Upgrades - Lumbar Support, Rear Head Restraints, Black Cloth interior, Standard Features - Electric Windows, In Car Entertainment, 3x3 point rear seat belts, Alarm, Alloy wheels, Child locks & Isofix system, Electric windows, Electric door mirrors, Central locking, Airbags, Height adjustable drivers seat, Lumbar support, Power steering, Traction control, Immobiliser, Folding rear seats. 5 seats, This car will require a new throttle cable as it is stretched. Does run and drive! Our Vehicles are sold at Trade Sale Prices. Viewing is always recommended on vehicles and we encourage customers to test drive whether you buy from ourselves or not., ++ Part Exchange Welcomed ++, £450 p/x welcome"
corsa,"Tested while April 16 just had new exhaust. new clutch fitted in September 15. Comes with private plate been offered four hundred pound for it on regtransfers got cd player 4 good tyres ideal 1st car, BLUE, CD player, Folding rear seats, Spare wheel (Full). 5 seats, £500"
corsa,"Vauxhall Corsa - 1995 - 1.2 LS 0nly 2 owners from new with 72910 miles. , , This has been owned for the last 12 years and has spent a lot of it garaged due to working in London. It has been regularly serviced and MOT'd and would be an ideal first car. It has been very reliable apart from a new battery which has just been fitted. All of the tyres have plenty of tread left. There is a remote control Sony CD which has been added, but otherwise completely standard. This car has also been owned by non smokers and was originally bought at a car boot sale. No canvassers please. Genuine reason for sale., BLUE, 2 owners, Next MOT due 25/08/2015, Part service history, £495"
corsa,"11 Month MOT. VERY VERY GOOD RUNNER. LOOKS AND DRIVES ABSOLUTELY FANTASTIC. Very economical cheap runaround car  Full service history. Nearly brand new tyres recently fitted. Absolute bargain for only 475 ono., SILVER, 5 seats, £475"
astra,"RED, No offers, No timewasters. Call york 01904 622277, Air-Conditioning, Electric Windows. 5 seats, £195"
polo,"RED, SOLD SOLD SOLD. Please contact Steve at the sales team on 07850074289 or view www.ryepecktrading.co.uk, Next MOT due 12/02/2016, 5 seats, Part exchange. This small vw polo is mechanically excellent drives superb and the clutch and gearbox are excellent.  Regards to bodywork she has seen better days this is reflective in the purchase price. ideal restoration project body why or just perfect for running around.  no mechanical fault and please no foolish offer . Contact max at Whitstable motor trading on 07948464723, £450"
fiesta,"RED, MOT UNTIL OCTOBER, Alarm, In Car Entertainment. 5 seats, £395"
polo,"Metallic BLUE, PRICED TO SELL, EXHAUST BLOWING BUT MAKE A CHEAP FIRST CAR, Next MOT due 09/02/2016, 5 seats, MDM Motor Group opening hours: Monday to Friday 9am til 7pm Saturday 9.30am til 5pm Sunday 9.30am til 4pm. More info tel 0113 2422600 mob 07752074603. Over 100 Sports, Prestige, People carriers and Diesels instock on our website with stock changing daily. Visit www.mdmmotorgroup.co.uk. MDM Motor Group, BROOKFIELD STREET, HUNSLET, LEEDS, LS10 1JX, OPPOSITE THE COSTCO CASH AND CARRY ON HUNSLET ROAD, £395 p/x welcome"
corsa,"BLUE, CALL ON 07703388520 FOR MORE INFO, Sunroof Manual, In Car Entertainment. 5 seats, 10, TAVISTOCK STREET, DUNSTABLE, OPPOSITE TESCO PETROL STATION LU6 1NE # 07535422049/07703388520, £399 p/x welcome"
corsa,"GREY, CHEAP INSURANCE, £495 px to clear! NO offers NO timewasters , P REG / 1997 , MOT TILL 14th JAN 2016, TAX 1ST SEPT 2015 (NON TRANSFERRABLE), GENUINE 95K MILES – VERIFIED BY VOSA CHECK AND PREVIOUS MOT RECORDS , 5 DOOR HATCHBACK, AUTOMATIC AUTO, ALARM IMMOBILISER, GOOD TYRES, SILVER COLOUR CODED  BODYWORK , POWER STEERING , RECENT NEW EXHAUST, 4 PREVIOUS OWNERS , GREAT FIRST CAR OR RUN AROUND CHEAP INSURANCE, FUEL, TAX ETC, , FULL V5C REGISTRATION DOCMUNENT/ LOGBOOK PRESENT, Located in Stamford Hill London n16. , , Seven sisters/ Manor house (both 10 mins away). Nearest Overground is Stoke Newington (a 5 min walk) which is a 10 mins by train from London Liverpool Street. , , *Altho trade cars are working, we do not know the history nor have road tested them to ascertain defects (major or minor). Vehicles are not mechanically inspected. , PRIVATE BUYERS: For satisfaction pottential buyers encouarged to bring own qualified mechanic for inspection.  TRADE PRICES (not retail) SO TRADE SALE TERMS ONLY. NO WARRANTY, will be sold as spares and repair and unroadworthy, no matter how good the condition your mechanic says it is. if you want a warranty - pay the forecort retail for the particular vehicle and you will be given one. Please do not to expect a vehcile sold to you way under private value and then receive services of a car bought at a substansively higher price from a showroom!, £495 p/x considered"
corsa,"GREEN, LAST OWNER FOR 14 YEARS, Grey Cloth interior, £450 p/x to clear"
fiesta,"New front brake discs & pads, CAM Belt less than a year old, new rear shock absorber, new battery with 18 months warranty remaining., BLUE, 4 owners, Next MOT due 08/05/2016, No service history, Manual sunroof, Height adjustable driver's seat, Folding rear seats, Spare wheel (Full), Driver's airbags, Passenger airbags. 5 seats, £375"
