model,description
corsa,"£490 ONO , 1999 Vauxhall Corsa 1.2 16v 5 door. , Car has 1 previous lady owner (family friend) and unlike many, comes with a genuine Vauxhall CD player and sunroof. , The car was last serviced last August., , The car does have some age related marks as to be expected and has no rust. , This would make an ideal first car and is cheap to run and insure... , , Please feel free to call, BLUE, 2 owners, Next MOT due 15/07/2015, Full service history, Manual sunroof, CD player, Height adjustable driver's seat, Folding rear seats, Spare wheel (Full), Power steering, Steering wheel rake adjustment, Central locking, Alarm, Driver's airbags, Passenger airbags. 5 seats, £490"
500,"Metallic GREY, JUST BEEN SERVICED. 2 SERVICES.  AIR CON. CD. WARRANTED MILEAGE. HPI CHECKED. 3 MONTHS WARRANTY INCLUDED., Next MOT due 28/05/2016, ABS, Adjustable Seats, Air Bag, Air Con, Alarm, Front Electric Windows, Front Fog Lights, Front Head Restraints, Electric Mirrors, CD Player, Cloth Interior, Cloth Upholestry, Manual, PAS, Power Assisted Steering, Rear Head Restraints, Rear Wiper, Remote Central Locking, Steering Wheel Rake, Wheel Trims. 4 seats, This Vehicle Is In Good Condition Inside/Out. Drives And Performs Superb. 2 Keys. Part Service History With 2 Service Stamps. Just Been Serviced At 39k In 05/2015. One Mature Owner From New. First To See Will Buy. Hpi Checked., £4,495 p/x welcome"
500,"white, L, Next MOT due 29/04/2016, Alarm, Airbags, CD Player, Electric Windows, Electric door mirrors, Immobiliser, Central locking, Radio, Power steering. 4 seats, TOLWORTH CARS ltd ,WE ARE BASED IN COBHAM, MANOR FARM, COBHAM, KT113PY , Call dealer now Phone Number Tel: (07475)526552, £3,450"
polo,"SILVER, HPI CLEAR. STARTS AND DRIVES OK. SOLD AS SPARES/REPAIRS AS MOT HAS JUST EXPIRED. COMES WITH FULL SERVICE HISTORY . BARGAIN TO CLEAR, Black Cloth interior, In Car Entertainment, Power steering, Airbags. 5 seats, DEBIT/CREDIT CARD FACILITIES AVAILABLE. PX ALWAYS A PLEASURE. VIEWING BY APPOINTMENT, HP12 3RH, £295 p/x to clear"
corsa,"Vauxhall corsa (51 Plate , 2002) 1.2sxi black 3 door sports - petrol for sale. Very nice and clean car. I had it for more than 2 years. Selling it because I have bought a bigger car., BLACK, 5+ owners, Next MOT due 29/09/2015, Part service history, Electric windows, CD player, Folding rear seats, Spare wheel (Full), Driver's airbags, Passenger airbags. 5 seats, £450"
polo,"Vw polo 1.0 petrol, , Very economical and cheap insurance, , Mechanically excellent no faults, , 10 months mot, , Tax will be refunded due to new law., , Bodywork in excellent condition for year., , Bbs alloy wheels, electric windows , toad alarm system, remote central locking etc...., , Drive away, , Thanks call for more info...., SILVER, 5 seats, £595"
500,"RED, low mileage immaculate condition , full service history , spare key , 3 owners from new , last owner had it since 2011,, Next MOT due 21/04/2016, Air-Conditioning, Alloy Wheels, Electric Windows, In Car Entertainment, Tinted Glass, Alarm, Alloy wheels, CD Player, Central locking, Height adjustable drivers seat, Immobiliser, Radio, Remote central locking, Leather seats, Power steering, Electric door mirrors, Airbags, Sports seats. 4 seats, I HAVE ANOTHER FIAT 500 WHITE 1.2 PETROL 67K , 12 MOT , FULL SERVICE HISTORY ,we are open 7 days , all major credit and debit card accepted, warranties are available , part ex welcome ,, £4,499"
focus,"SILVER, SPARES  OR REPAIR, DRIVES, NO MOT JUST RAN OUT THIS MONTH., Air-Conditioning, Alloy Wheels, Computer, Electric Windows, Heated Front Screen, In Car Entertainment, Seats Electric. 5 seats, WE'VE CHNAGED ADDRESS! AS OF 1ST MAY WE ARE AT MAULDEN GARDEN CENTRE, A507, MK452GP, £195"
500,"SILVER, Upgrades - Air Conditioning, Blue&Me, Metallic Paint, Foglights, Remote central locking, Driver airbag, Passenger airbag, Next MOT due 29/10/2015, Service history, Clean bodywork, Interior - Clean Condition, Tyre condition Good, Standard Features - Electric Windows, In Car Entertainment. 4 seats, £4,500 p/x welcome"
fiesta,"GREEN, Next MOT due 06/07/2015, Average bodywork, Interior - Average Condition, Tyre condition Average, Alloy Wheels, Electric Windows, In Car Entertainment. 5 seats, UK DELIVERY, FINANCE AVAILABLE, 85 Cars OFFERED, test drive welcome CALL 01274710599 or 07799080004, £395 p/x welcome"
corsa,"Hornchurch, Essex area., , Newly fitted handbrake., Newly fitted exhaust., Cheap to run, tax, insure and maintain., Good first car., Small dent located on the back of the car., SILVER, Air conditioning, CD player. 5 seats, £495"
focus,"BLUE, ++ 6 MONTHS MOT ++ ONLY 2 PREVIOUS OWNER ++ SOME HISTORY ++, Air-Conditioning, Alloy Wheels, Electric Windows, Heated Front Screen, In Car Entertainment. 5 seats, LOOKS AND DRIVES WELL FOR AGE, PRICED TO SELL..., Open 7 days a week, Monday-Thursday 9 til 7, Friday 9 til 6, Saturday 9 til 5 and Sunday 11 til 4, £390 p/x considered"
500,"WHITE, FIAT 500 1.2 SPORT, ONE OWNER + COMPANY, JUST BEEN SERVICED AT CURRENT MILEAGE, IDEAL FIRST CAR, CHEAP TO RUN AND MAINTAIN, TWO KEYS INCLUDED, GREAT SPEC ON THIS WITH ALLOY WHEELS, REAR SPOILER, PRIVACY GLASS, MULTI FUNCTION S/WHEEL WITH AUDIO CONTROLS, RADIO / MP3 CD PLAYER / WINDOWS MOBILE WITH USB PORT, HALF LEATHER SPORT INTERIOR, ON BOARD COMPUTER WITH MPG INDICATOR AND MORE BELOW, FIRST TO SEE WILL BUY, DRIVEAWAY COVER AND EXCELLENT FINANCE RATES AVAILABLE..Alloy Wheels, Computer, Electric mirrors, Electric Windows, MPG Indicator, Multi function steering wheel, Steering Mounted Audio Control, Rear Spoiler, Front Storage Compartment, Trip computer, Thermometer, Radio/MP3 CD, 2x Front And Rear Drink Holders, Service Indicator, Traction Control, Privacy Glass, Digital Clock, Folding Rear Seats, Sport Seats..MANY MORE VEHICLES IN STOCK ALL AT COMPETITIVE PRICES..JUST SIMPLY CLICK THE LINK TO OUR WEBSITE ON THIS ADVERT TO VIEW OUR COMPLETE STOCKLIST..CALL TODAY TO LEAVE A SMALL DEPOSIT & SECURE THIS VEHICLE..Ref No. 53, All Vehicles Available From 2004/2005/2006/2007/2008/2009/2010/2011/2012/2013/2014/2015.., £3,989 p/x welcome"
polo,"BLACK, TRADE CARS NORTHWICH LTD CW97DR CALL 07880350295 / 07760670682, Upgrades - Anti-lock brake system, Next MOT due 06/02/2015, Standard Features - Height adjustable steering column, Sony XR3759 radio/cassette, Electric heated + adjustable door mirrors, Engine immobiliser. VISIT OUR WEBSITE WWW.TRADECENTREWARRINGTON.CO.UK, £690"
polo,"Great condition! clean interior, Very Low on tax and insurance. Has a few age related marks, ideal first car., 102,000 miles , 3 door, 5 seats, Blue, Alloy wheels, 999 cc, 2000, 11 months M.O.T, Manual, Hatchback, CD Player / AUX and USB Port, no power steering but drives well., BLUE, 5 seats, £500"
astra,"Blue, 5 seats, TRADE IN TO CLEAR MOT TILL OCT 18TH 2015, DRIVES FINE, ENGINE MANAGEMENT LIGHT ON STATING FAULTY 02 SENSOR (LAMBDA), HAS NOT BEEN THROUGH WORKSHOP HENCE SOLD AS SPARES OR REPAIRS Â£350 CHEAP SUMMER CAR., £350"
polo,"RED VW POLO FOR SALE - ONLY FOUR PREVIOUS FEMALE OWNERS, For sale - my first car a very good runner having only had four previous female owners. service history. I have all receipts of work done on car and original booklets I have had this car since 2009 and have only driven 6000 miles in it. It's passed its MOT every year I have had it. This is a great first time car - very cheap to insure and tax. Petrol 5 door hatchback it has just had a brand new RAC approved battery installed and front tyre replaced. Sold as seen., RED, 4 owners, Next MOT due 21/02/2016, Full service history, Electric windows, CD player, Height adjustable driver's seat, Folding rear seats, Metallic paint, Central locking, Immobiliser, Driver's airbags, Passenger airbags. £495"
500,"BLACK, HERE WE HAVE A FIAT 500 BLACK COLOUR , THIS VEHICLE HAS ALOT OF SPEC , 6 SPEED GEAR BOX PLUS YOU CAN OUT IT IN SPORTS MODE , THE LAST MOT PASSED WITH NO ADVISORIES ,, Electric Windows, In Car Entertainment. 4 seats, HERE WE ARE DELIGHTED TO OFFER YOU OUR 2008 FIAT 500 1.4 SPORT WHICH HAS MOT TILL THE 18th OF SEPTEMBER 2015, ** TIMING BELT HAS BEEN CHANGED AT 70,000 MILES **, CAR COMES WITH 2 ORIGINAL KEYS, ** CURRENT MOT PASSED WITH NO ADVISORIES **, CAR IS FULLY HPI CLEAR, ** COMES WITH VERY GOOD SPEC ** WHICH INCLUDES 6 SPEED MANUAL GEARBOX WITH SPORT MODE, FACTORY FITTED HANDS FREE + USB + CD PLAYER + RADIO + ELECTRIC WINDOWS + MIRRORS + CENTRAL LOCKING + LEATHER INTERIOR AND MORE, ** ONLY HAS A 1368 cc ENGINE THAT GIVES YOU 44.8 MPG (COMBINED) SO IT IS ECONOMICAL WHICH MAKES IT AN IDEAL FIRST CAR, MUST BE SEEN TO BE APPRECIATED, WELCOME TO ANY RAC // AA INSPECTION, TO ACQUIRE THIS BEAUTY, PLEASE CALL OUR FRIENDLY STAFF TODAY FOR FURTHER INFO !!!, CONTACT US ON 01212445218 AND 07577773100, £3,795"
polo,"Metallic BLUE, 12 months MOT, No service history, Excellent bodywork, Beige Cloth interior - Clean Condition, Tyre condition New, Radio. 5 seats, £645"
polo,"RED, vw polo, Next MOT due 20/10/2015, Sunroof Electric, Alloy Wheels, Electric Windows, In Car Entertainment. 5 seats, Plese note there is no 5th gear  car still runs and drives lovely  but no 5th gear   car is fully loaded   every extra   alloys cd player  sunroof electric windows   good tyers all round   first to drive will buy  no timewasters please px available delivery available ring me for more information on 07948 169222   px available, £595"
fiesta,"Genuine 58600 miles from new , Owned the vehicle over a year in that time it's had 2 new tyres,new battery,rear axle bushes & new centre pipe on the exhaust, Drives well with no knocks or bangs, gearbox is in good order gear selection is nice at tight (feels like new), Front wheel arches have surface rust coming through,couple of small dents in the boot don't forget this is a 15yr old car, SILVER, CD player, Folding rear seats, 14"" Alloy Wheels, Power steering, Central locking. 5 seats, £400"
focus,"Tyre condition Excellent, Air-Conditioning, Alloy Wheels, Electric Windows, Heated Front Screen, In Car Entertainment. 5 seats, 07413646524, BLUE, 5 seats, £500"
corsa,"SILVER / 40+ BARGAIN CARS FROM £395 - £2495, PLEASE CALL 01204 770815 OR 07964 940192. GOOD CONDITION, DRIVES WELL, WILL COME WITH A NEW 12 MONTH MOT, IDEAL FIRST CAR, LOW TAX AND INSURANCE GROUP, CD Player, Central locking, Electric Windows, Electric door mirrors, Power steering, Radio, Sunroof. 5 seats, PLEASE CALL FOR THE LATEST BARGAINS AS NOT ALL OUR CARS ARE ADVERTISED. CARS SOLD QUICKLY AND STOCK CHANGES DAILY. OVER 40 CARS AT OUR PART EXCHANGE GARAGE, 100+ CARS IN STOCK FROM £395. VISIT OUR WEBSITE www.wateringpoolcars.co.uk FOR ALL BARGAIN CARS CALL 01204 770815 OR 07964 940192 ANYTIME, BL6 7BD., FINANCE ARRANGED, WARRANTY, VALET, PART EX, HPI REPORT, MOT, SERVICE, CALL ANYTIME 07966586099., £495"
polo,"RED, Power steering, Long MOT, This is a part exchange priced to clear, Lacqure on bonnet peeling other wise clean for year, Electric Windows, In Car Entertainment. 5 seats, CM4 0EQ Not all of the vehicles are displayed on site, booking an appointment is essential., £650"
focus,"BLUE, 3 OWNER CAR CHEAP DIESEL, Air-Conditioning, Alloy Wheels, Electric Windows, In Car Entertainment. 5 seats, BUY NOW OR MAKE AN OFFER Many more cars available visit our website www.thenwca.co.uk or telephone 0161 402 0201, WE ARE A CAR AUCTION BASED AT PLOT 0, JAMES NAYSMYTH WAY, ECCLES, MANCHESTER M30 0SF ALL AUCTION TERMS AND CONDITIONS APPLY. WE HAVE THE OPTION FOR 5 DAY DRIVE AWAY COVER, MOST TYPES OF PAYMENTS ACCEPTED.  WANT TO SELL YOUR CAR NO WIN NO FEE WHY NOT GIVE US A TRY., £350"
500,"Pearlescent Funk White, Please Be Aware This Car Needs Paintwork Down Nearside Door/Rear Quarter (See Pic 5), Upgrades - Pearlescent Paint, Foglights, Next MOT due 17/07/2015, Full service history, Clean bodywork, Beige Cloth interior - Clean Condition, Tyre condition Good, Standard Features - Electric Windows, In Car Entertainment. 4 seats, Drives Nice Needs Paintwork Down Nearside,HPi Clear Unwanted P/X Hence Price, £3,990"
500,"Lady owner for last 4 years. Low mileage. Great runner. Just been serviced and new brake pads and discs fitted. New bulbs and Wheel Hubs. In Good Condition. With Bluetooth and Steering wheel radio controls., WHITE, 2 owners, Next MOT due 03/08/2015, Part service history, Electric windows, CD player, Leather trim, Folding rear seats, Spare wheel (Space-saver), Power steering, Central locking, Driver's airbags, Passenger airbags. 4 seats, £4,250"
focus,"SILVER, MINOR FRONT & REAR DAMAGE, Alloy Wheels, Electric Windows, In Car Entertainment. TO VIEW OR FURTHER 500 SIMILAR DAMAGED VEHICLES GO TO www.chaseautos.com, £425"
golf,"SILVER, Air-Conditioning, Climate Control, Alarm, Alloy Wheels, Computer, Electric Windows, In Car Entertainment. 5 seats, OVER 100 CARS IN STOCK WE SPECIALISE IN SPORTS PERFORMANCE AND PRESTIGE VEHICLES PX WELCOME, £500"
500,"Solid BLACK, 5 DAYS DRIVEWAY INSURANCE !!!, 3 months warranty, 12 months MOT, Excellent bodywork, Grey Cloth interior - Excellent Condition, Tyre condition Excellent, Electric Windows, In Car Entertainment. 4 seats, 8 BERESFORD AVENUE, WEMBLEY HA0 1SA, £4,495 p/x welcome"
focus,"BLUE, 1 OWNER FROM NEW FROM 2003, FULL SERVICE HISTORY, LOTS OF RECEIPTS OF WORK DONE TO THE CAR LAST YEAR AND PREVIOUS YEARS ,CLUTCH HAS BEEN CHANGED, TWO KEYS, Next MOT due 20/08/2015, Electric Windows, Heated Front Screen, In Car Entertainment, Airbags, Alarm, Child locks & Isofix system, Central locking, Folding rear seats, Immobiliser, Power steering, Electric windows, Remote central locking. 5 seats, ALL PREVIOUS MOT'S AVAILABLE, DRIVES PERFECT, LOW MILEAGE FOR ITS AGE, CHEAP TO RUN, CHEAP TO INSURE,  IDEAL FAMILY CAR,  CLEAN INTERIOR, BODY REQUIRES SOME ATTENTION HENCE THE PRICE, CAR IS AVAILABLE TO VIEW 7 DAYS A WEEK, GRAB YOURSELF AN EARLY BARGAIN!!!, £475"
500,"FULL DEALERS SERVICE HISTORY. MOT'D TILL JANUARY 2016 WITH NO ADVISORIES ON LAST MOT. One lady owner since 2010, excellent condition inside and out, great car to drive, never had any problems with it. Very economical. Cheap to tax and insure ?20 per year tax - PERFECT FOR 1ST TIME DRIVERS/STUDENTS. All tyres and brakes are in great condition. GENUINE REASON FOR SALE. FIRST TO SEE WILL BUY., GREY, 2 owners, Next MOT due 14/01/2016, Full service history, Electric windows, Air conditioning, Parking aid, CD player, Folding rear seats, Metallic paint, Alloy wheels, Spare wheel (Full), Power steering, Steering wheel rake adjustment, Central locking, Alarm, Driver's airbags, Side airbags, Passenger airbags. 4 seats, £4,495"
500,"RED, Nice Tidy Example, Drives Well, Great Spec, Cheap Insurance, Full Service History 7 Stamps, Provided With 12 Months Mot, 3 Months Warranty, Upgrades - Alloy Wheels 16in Lounge, Sunroof, Velour interior, Standard Features - Electric Windows, In Car Entertainment. 4 seats, Part Exchange Welcome, All Major Debit & Credit Cards Welcome, All Our Vehicles Come HPi & NMR Checked, Low Rate Finance Available, 3 Months Warranty, Open 7 Days A Week, Please Visit www.a5automotive.co.uk For All Our Quality Used Cars, For The Best Deal On Your Next Vehicle Visit Our Showroom Today Situated Only 2 Minutes From Junction 10 M42 Tamworth Staffordshire., Quality Used Cars At Trade Price, View Today In Tamworth Only 2 Mins From Jnc 10 M42, £4,489 p/x welcome"
corsa,"RED, POWER STEERING, Electric windows, Central locking, Sunroof. This trade px drives well. VGC throughout. MOT 17TH JULY 2015., 5 seats, Would put full mot on for extra £95.00.Ideal first car or learner. PLEASE NO OFFERS., £395"
polo,"GREEN, IDEAL FOR FIRST TIME DRIVERS,LOADS OFF INVOICE'S, MILEAGE CHECKED AND VERIFIED, CHEAP INSURANCE AND LOW ON ROAD TAX, EXCELLENT ON FUEL, Next MOT due 15/12/2015, Service history, DRIVE'S SUPERB, PART EXCHANGE CARS PRICE WILL BE DIFFERENT ALL WELCOME, WE CAN ARRANGE ROAD TAX FOR YOU 7 DAYS A WEEK FOR NEW BUYER. WE ACCEPT ALL MAJOR DEBIT & CREDIT CARDS. WE HAVE OVER 100 CARS IN STOCK. PLEASE VISIT OUR WEBSITE, WWW.A47CARS.COM. DELIVERY AVAILABLE NATIONWIDE £2 A MILE ANYWHERE IN THE U.K, WHY NOT GIVE US A CALL AND BOOK A TEST DRIVE TODAY VIEWING BY APPOINTMENT CALL US 01733 734685 OR 07440360452, a47cars@hotmail.com. OUR ADDRESS IS EYE GREEN INDUSTRIAL ESTATE 1 CROWLAND ROAD PE6 7TN, £586"
fiesta,"BLUE, p/x to clear no mot sold for spares or repair, In Car Entertainment. 5 seats, nice alloy wheels two keys central locking cd player, £195"
corsa,"SILVER, SOLD FOR SPARES Or REPAIRS., Electric Windows, In Car Entertainment. 5 seats, FINANCE ARRANGED. PLS Call Reece to arrange a viewing 07552330330 - or 01277 724710, £190"
polo,"SILVER, Air-Conditioning, Climate Control, Electric Windows, In Car Entertainment. 5 seats, STARTS AND RUNS BUT ENGINE HAS A MISS FIRE + THIS IS BEING SOLD FOR SPARES OR FOR REPAIR + TRADE SALES + NO MOT + STACKS OF SERVICE HISTORY +, £489 p/x considered"
500,"WHITE, Upgrades - 500 Stripe, Leather, Side Stripe, Leather Steering Wheel with Commands, Split Folding Rear Seat with Head Restraints, Alloy Wheels 16in (Sport), 3 months warranty, 12 months MOT, Last serviced on 09/08/2012 at 58,583 miles, Clean bodywork, Black Full leather interior - Clean Condition, Tyre condition Good, Standard Features - Electric Windows, In Car Entertainment, Air conditioning, Electric door mirrors, Remote central locking, Traction control, CD Player. 4 seats, This car comes fully serviced and have 12 months M.O.T, 3 month warranty and are HPI clear, £4,500 p/x poss"
500,"Metallic SILVER, FREE 2 YEAR SERVICING WITH THIS VEHICLE, Upgrades - Metallic Paint, Electric Mirrors - Body Coloured, Leather Steering Wheel with Commands, Red Cloth interior, Standard Features - Electric Windows, In Car Entertainment. 4 seats, £4,590 p/x welcome"
focus,"the car is good runner, BLUE, 5 seats, £350"
polo,"1.9 D CL 3dr Service History, drives well, good condition, MOT, spare keys, 2 former lady owners, 4 new tyres, mechanically sound.., RED, Electric windows, Power steering, Steering wheel rake adjustment. 5 seats, £650"
corsa,"Metallic STAR SILVER, Vauxhall Corsa 1.0 i 12v Envoy 3dr, 12 MONTH MOT ISSUED ON THE SALE!, VIEWING IS ESSENTIAL & HIGHLY RECOMENDED, GUARANTEED HPI CLEAR, IDEAL 1st CAR or VERY CHEAP LITTLE RUNABOUT, LOW MILEAGE~~LOW MILEAGE, EXTREMELY ECONOMICAL, EXCELLENT RUNNER, LOW INSURANCE GROUP £££ LOW INSURANCE £££ LOW INSURANCE!!, 5 SPEED GEAR BOX, In Car Entertainment, CD Player, Radio, Folding rear seats, GREAT SIZE BOOT, 12 MONTHS MOT~~~12 MONTHS MOT, EXTREMELY COMFORTABLE GREY CLOTH INTERIOR, HPI CLEAR---HPI CLEAR. 5 seats, VERY VERY EASY TO MAINTAIN & TO SOURCE PARTS, MANY MORE LOW INSURANCE VEHICLES AVAILABLE FOR UNDER & AROUND A £1000!!!!!, ALL DEMONSTRATIONS WELCOME - OVER 100 VEHICLES TO CHOOSE FROM - OPEN 7 DAYS A WEEK, £490"
polo,"BLUE, Next MOT due 01/08/2015, Electric Windows, In Car Entertainment. 5 seats, Very clean car,drives extremely  well,electric windows and mirrors,c/Locking, 1.4 engine,still being driven daily,no major issues with the car,cheap reliable runaround,mot till august, £695"
polo,"I'm selling my Volkswagen Polo as have bought a new car. Is a good wee run around. Needs some TLC. Has scratches up both sides as pictured above. Electric windows broken. Perfect for a first car or for parts., RED, 3 owners, Next MOT due 29/04/2015, Part service history, Electric sunroof, Electric windows, Air conditioning, Folding rear seats, Alloy wheels, Spare wheel (Full), Driver's airbags, Passenger airbags. 4 seats, £350"
corsa,"WHITE, £390"
astra,"2 month's mot,, , Rust spot as seen in picture , New bulbs needed, Always starts first time, Lots of old mots and service, GREEN, Electric windows, MP3 player, Child seat points (Isofix system), Metallic paint. 5 seats, £325"
corsa,"Metallic SILVER, Cheap Corsa ... Already scratched & a few dents but Nov 2015 MOT (last of old model), In Car Entertainment. 5 seats, We are different, No high pressure salesmen - we are a small family run business, selling all our cars ourselves with 30 years experience, 70% of our custom is made up of word of mouth and repeat customers, many of which come back year after year for servicing, repairs and tyres, We offer a personal service, value for money and high quality cars, We have an onsite garage with tyre fitting bay staffed by 7 mechanics, Call & see us or visit our website and see what we can do to help, £450"
500,"Metallic BLACK, 101995 Miles, Next MOT due 28/11/2015, Full service history, Excellent bodywork, Interior - Excellent Condition, Tyre condition Good, 4 seats, 101995 Miles, Next MOT due 28/11/2015, Full service history, Excellent bodywork, Interior - Excellent Condition, Tyre condition Good, Air Bag Driver, Air Bag Knee, Air Bag Passenger, Air Bag Side, Central Door Locking, Electric Windows, Head Restraints, Immobiliser, In Car Entertainment, Mirrors External, Power-Assisted Steering, Seat Height Adjustment, Spare Wheel, Speakers, Steel Wheels, Upholstery Cloth, 3x3 point rear seat belts, Airbags, Central locking, CD Player, Height adjustable drivers seat, Radio, Power steering, Electric windows, Electric door mirrors. 4 seats, HPI CHECKED, FINANCE & WARRANTY PACKAGES AVAILABLE. PLEASE VISIT WEBSITE FOR DETAILS AND MORE PHOTOS, HPI CHECKED, FINANCE & WARRANTY PACKAGES AVAILABLE. PLEASE VISIT WEBSITE FOR DETAILS AND MORE PHOTOS REF:AZEU, HPI CHECKED, FINANCE & WARRANTY PACKAGES AVAILABLE. PLEASE VISIT WEBSITE FOR DETAILS AND MORE PHOTOS, £4,000"
fiesta,"GREEN, Next MOT due 25/01/2015, Sunroof Manual, Alloy Wheels, In Car Entertainment. Please CALL or TXT  07557 900739 out of opening hours , Sorry we do not take offers on our cars, £345 p/x to clear"
fiesta,"SILVER, N/S FRONT DAMAGE, Electric Windows. TO VIEW OUR FURTHER 500 SIMILAR DAMAGED VEHICLES GO TO www.chaseautos,com, £395"
golf,"This car has been in a garage for the last 2 years it is on a Sorn Declaration, It was a nice runner but no MOT on it needs a bit of work Open to offers, BLUE, Electric windows, Leather trim, Height adjustable driver's seat, Spare wheel (Space-saver), Power steering, Central locking, Alarm, Immobiliser, Driver's airbags. £400"
polo,"Solid blue, mot 30 10 15   f s h  nice car, Grey Cloth interior, 5 seats, cheap cars   p/x welcome, £395 p/x to clear"
polo,"RED, Next MOT due 20/11/2015, In Car Entertainment. 5 seats, VW POLO CLEAN CAR INSIDE AND OUT, WARRANTED MILEAGE WITH FULL VOSA HISTORY, HPI CLEAR,, CHEAP TO RUN, MECHANICAL SOUND, SMOOTH ENGINE CLUTCH AND GEARBOX, LONG MOT, FIRST TO SEE WILL BUY,, FOR MORE DETAILS PLZ CALL OR TAX MESSAGE 07526586325, Website www.hafizmotors.co.Uk. OPEN 7 DAYS.. LOCATION NELSON BRIERFIELD BB9 5NH, 3 GLEN WAY, £480"
corsa,"blue, Next MOT due 31/12/2015, Service history, Clean bodywork, Grey Cloth interior - Excellent Condition, Tyre condition Excellent, 5 seats, VIEWING BY APPOINTMENT 08.00 AM - 20.00 pm MONDAY TO SUNDAY, £395 p/x welcome"
polo,"V W POLO 1.4 MATCH Reg 51 Blue color coded Bumpers and dr mirrors 3/dr petrol 2 keys 6 CD changer Just had oil n filter change + new rear exhaust box (tx bnd F) v/g runner, BLUE, 3 owners, Next MOT due 01/06/2015, Part service history, Electric windows, Air conditioning, CD player, Height adjustable driver's seat, Power steering, Central locking, Immobiliser. 4 seats, £600"
focus,"SILVER, DENT ON N/S REAR WHEELARCH, Alloy Wheels, Electric Windows, In Car Entertainment. 5 seats, TO VIEW OUR FURTHER 500 SIMILAR DAMAGED VEHICLES GO TO www.chaseautos .com, £295"
corsa,"Metallic SILVER, MOT'D - POWER STEERING - DRIVES REALLY WELL - ECONOMICAL 1.4 - CHEAP TO INSURE, TAX AND RUN, Cloth interior, Sunroof Manual, Computer, In Car Entertainment. 5 seats, £399"
focus,"mot,black,goog condition, BLACK, 5 seats, £499"
golf,"Great car, good runner, starts first time, doesn't smoke. A few scuffs and scratches as expected from a car of this age. Company car forces sale. Please call if you would like to view or test drive. My new dog managed to chew a little of the back seat and rear headrest, shown in photo. Mot'd until October. Open to offers, BLACK, Electric windows, Air conditioning, CD player, Height adjustable driver's seat, Folding rear seats, Child seat points (Isofix system), Spare wheel (Full), Power steering, Central locking, Alarm, Driver's airbags, Passenger airbags. 5 seats, £450"
focus,"SILVER, HAS ISSUES WITH BRAKES, Next MOT due 01/10/2015, Alloy Wheels, Electric Windows, In Car Entertainment. 5 seats, REQUIRES BRAKE SERVO UNIT , HENCE PRICE, Please CALL or TXT  07557 900739 out of opening hours , Sorry we do not take offers on our cars, £300 p/x to clear"
corsa,"BLACK, Next MOT due 14/05/2016, In Car Entertainment. 5 seats, VIEWINGS BY APPOINTMENTS ONLY, £495 p/x welcome"
golf,"*58,000 MILES* MOT DUE NOVEMBER, LARGELY IN GREAT CONDITION, Selling as it has an intermittent engine problem. One small dent on the front otherwise in good condition. Would be fantastic as a project or for parts. Very low mileage due to OAP owning for most of it's life., BLUE, 3 owners, Next MOT due 01/11/2015, Full service history, Power steering, Central locking. 5 seats, £200"
focus,"BLUE, Won't take much to MOT, Alloy Wheels, Electric Windows, In Car Entertainment. 5 seats, £250"
fiesta,"Ford fiesta Encore 1.3L 57,000 miles on the clock ideal first car or little run around. Need a quick sale as relocating and will not need the car. MOT until november, BLUE, 5 seats, £300"
corsa,"Metallic yellow, +++ MOT MARCH 19TH 2016 +++, Cloth interior, 5 seats, £499"
focus,"BLACK, Good runer, Air-Conditioning, Alloy Wheels, Electric Windows, Heated Front Screen, In Car Entertainment. 5 seats, £495"
golf,"RED, Next MOT due 25/02/2016, No service history, Grey Cloth interior, Viewings and test drives by appointment so phone now to avoid disappointment. Sundays after 12.30., £200"
